{"collection_sha256":"ecc421e765660e6123b9f09106a1428394496cea6a4869a1be3fd2f492c73edf","compute":{"name":"gpu-t4-dedicated","size":"Standard_NC4as_T4_v3"},"dataset_manifest_sha256":"8f5d99deb06a31fa0a6203eded8a3591857817c0da510ce93d6750d245934044","evidence_source":"azure_ml_v2_cli","git_commit":"22889199a62835ea2adc5bfee5abf72d628e1002","pipeline_jobs":[{"name":"stoic_oyster_5fnf0gq9x2","seed":17,"status":"completed"},{"name":"mango_yam_7kpgtppkpq","seed":29,"status":"completed"},{"name":"purple_picture_m1n9fh45hn","seed":43,"status":"completed"}],"runs":[{"adapter_artifact_sha256":"dc2d2d2d0c9be657d25f477cfeb5f2eda04848c586425b93bed40b0329b6079f","component_name":"grpo_minimal","compute":"gpu-t4-dedicated","compute_size":"Standard_NC4as_T4_v3","dataset_manifest_sha256":"8f5d99deb06a31fa0a6203eded8a3591857817c0da510ce93d6750d245934044","end_time":"2026-09-01T22:09:35.689136+00:00","git_commit":"22889199a62835ea2adc5bfee5abf72d628e1002","job_name":"55784b63-2b10-49b4-a345-fa90ce2d088f","max_steps":100,"parent_job_name":"stoic_oyster_5fnf0gq9x2","run_manifest_sha256":"862b416a83f779339f6be6652c265af36caddfa32d4648a81f2d5c1c4e2cc4a8","seed":17,"seed_invariant_training_config_sha256":"1427244f4a3fc937a76b5f60391e078573258effaf591bfc98639843db957dee","source_sha256":"78bb2026f15cdcfe4e78c7ddf5f03198dee22816cfd0914f3106da7927efd553","stage":"minimal_provenance","start_time":"2026-09-01T19:29:36.064124+00:00","status":"completed","steps":100,"training_config_sha256":"4aa7c9b161eb229d107cf30b244fb26bb8cdea1f03f0cda6a92d917a4bda0e4f","wall_seconds":9599.625012},{"adapter_artifact_sha256":"d52935c126f3aa0d82d38c9f3fb62af7f05a9ad5eae23c8a9edf02832fa61eec","component_name":"grpo_naive","compute":"gpu-t4-dedicated","compute_size":"Standard_NC4as_T4_v3","dataset_manifest_sha256":"8f5d99deb06a31fa0a6203eded8a3591857817c0da510ce93d6750d245934044","end_time":"2026-09-01T23:38:40.607069+00:00","git_commit":"22889199a62835ea2adc5bfee5abf72d628e1002","job_name":"3354b4a3-163e-4b55-b9e1-862ed95564cb","max_steps":100,"parent_job_name":"stoic_oyster_5fnf0gq9x2","run_manifest_sha256":"136cab6d12ff4860d7afede57b679c05cdd14e1a3053d7af6e69dc627bffb37c","seed":17,"seed_invariant_training_config_sha256":"1427244f4a3fc937a76b5f60391e078573258effaf591bfc98639843db957dee","source_sha256":"78bb2026f15cdcfe4e78c7ddf5f03198dee22816cfd0914f3106da7927efd553","stage":"naive_recall","start_time":"2026-09-01T19:29:36.162200+00:00","status":"completed","steps":100,"training_config_sha256":"4aa7c9b161eb229d107cf30b244fb26bb8cdea1f03f0cda6a92d917a4bda0e4f","wall_seconds":14944.444869},{"adapter_artifact_sha256":"35a985f033ca3166050afbe5307bd519d882b6660d515c0d614934b2156d636c","component_name":"sft","compute":"gpu-t4-dedicated","compute_size":"Standard_NC4as_T4_v3","dataset_manifest_sha256":"8f5d99deb06a31fa0a6203eded8a3591857817c0da510ce93d6750d245934044","end_time":"2026-09-01T19:15:14.272978+00:00","git_commit":"22889199a62835ea2adc5bfee5abf72d628e1002","job_name":"724dce5e-5d08-4d25-bdf0-a20c16757532","max_steps":100,"parent_job_name":"stoic_oyster_5fnf0gq9x2","run_manifest_sha256":"e435767b178f213d493d6c996a533f2a44323f9a18945f411249d8b0684b8c78","seed":17,"seed_invariant_training_config_sha256":"ac0957e7450458f8cd0f0748236876f0df4e8ec3f430b5510d90bb412ed7d1a8","source_sha256":"78bb2026f15cdcfe4e78c7ddf5f03198dee22816cfd0914f3106da7927efd553","stage":"sft","start_time":"2026-09-01T18:39:26.443370+00:00","status":"completed","steps":100,"training_config_sha256":"eaaddd4eacdf68aa5755d10c3723459cb12ed5ddc59fc5f8f82b9b65102d7a1b","wall_seconds":2147.829608},{"adapter_artifact_sha256":"f92a1a638c779e18ccd8be00bf17218072309e01d33dfc0d71036c59a319cd30","component_name":"grpo_minimal","compute":"gpu-t4-dedicated","compute_size":"Standard_NC4as_T4_v3","dataset_manifest_sha256":"8f5d99deb06a31fa0a6203eded8a3591857817c0da510ce93d6750d245934044","end_time":"2026-09-02T00:26:15.259343+00:00","git_commit":"22889199a62835ea2adc5bfee5abf72d628e1002","job_name":"682b9b8f-4335-4c45-8975-f032353b19e7","max_steps":100,"parent_job_name":"mango_yam_7kpgtppkpq","run_manifest_sha256":"50afc8e3fb4580c57b7188667424fd973e484a016c2048d2546fce3e88e35cc4","seed":29,"seed_invariant_training_config_sha256":"1427244f4a3fc937a76b5f60391e078573258effaf591bfc98639843db957dee","source_sha256":"78bb2026f15cdcfe4e78c7ddf5f03198dee22816cfd0914f3106da7927efd553","stage":"minimal_provenance","start_time":"2026-09-01T19:44:51.074166+00:00","status":"completed","steps":100,"training_config_sha256":"91a1129dbebad80f9fa8ca0474603aa73595630bbc3b13f301ccc0cd12e7d647","wall_seconds":16884.185177},{"adapter_artifact_sha256":"a9267d608653515475a360619a17b7c38ab03e0423816c097f6539357b90e099","component_name":"grpo_naive","compute":"gpu-t4-dedicated","compute_size":"Standard_NC4as_T4_v3","dataset_manifest_sha256":"8f5d99deb06a31fa0a6203eded8a3591857817c0da510ce93d6750d245934044","end_time":"2026-09-02T01:55:55.258695+00:00","git_commit":"22889199a62835ea2adc5bfee5abf72d628e1002","job_name":"eb6549ff-1f08-40c3-85e5-3693e12a9519","max_steps":100,"parent_job_name":"mango_yam_7kpgtppkpq","run_manifest_sha256":"146eb50132a4399797c40e45ea7009e2e736076751077e50104c9e8e25d2c585","seed":29,"seed_invariant_training_config_sha256":"1427244f4a3fc937a76b5f60391e078573258effaf591bfc98639843db957dee","source_sha256":"78bb2026f15cdcfe4e78c7ddf5f03198dee22816cfd0914f3106da7927efd553","stage":"naive_recall","start_time":"2026-09-01T19:44:51.115751+00:00","status":"completed","steps":100,"training_config_sha256":"91a1129dbebad80f9fa8ca0474603aa73595630bbc3b13f301ccc0cd12e7d647","wall_seconds":22264.142944},{"adapter_artifact_sha256":"81925e87c3f1e38eef14efdc3e8a5417848b7facdc20adb1bd67bdae8af911fd","component_name":"sft","compute":"gpu-t4-dedicated","compute_size":"Standard_NC4as_T4_v3","dataset_manifest_sha256":"8f5d99deb06a31fa0a6203eded8a3591857817c0da510ce93d6750d245934044","end_time":"2026-09-01T19:30:31.225476+00:00","git_commit":"22889199a62835ea2adc5bfee5abf72d628e1002","job_name":"e94e22de-c963-4b5a-95b1-0bd4b87efcac","max_steps":100,"parent_job_name":"mango_yam_7kpgtppkpq","run_manifest_sha256":"f445c5e169097734efaf7bc265698036d9e0c2b7841818ba8c2576e62cdb9181","seed":29,"seed_invariant_training_config_sha256":"ac0957e7450458f8cd0f0748236876f0df4e8ec3f430b5510d90bb412ed7d1a8","source_sha256":"78bb2026f15cdcfe4e78c7ddf5f03198dee22816cfd0914f3106da7927efd553","stage":"sft","start_time":"2026-09-01T18:41:06.577023+00:00","status":"completed","steps":100,"training_config_sha256":"76d0090d4d866dbe1ab56ae801bb666c1c3567a04982b6f61ef5a15cfc4da4cc","wall_seconds":2964.648453},{"adapter_artifact_sha256":"958c1d6df63dae4e1616f263555c6119df3e59664f70eddaf1b2234ef2061c93","component_name":"grpo_minimal","compute":"gpu-t4-dedicated","compute_size":"Standard_NC4as_T4_v3","dataset_manifest_sha256":"8f5d99deb06a31fa0a6203eded8a3591857817c0da510ce93d6750d245934044","end_time":"2026-09-01T21:22:29.161967+00:00","git_commit":"22889199a62835ea2adc5bfee5abf72d628e1002","job_name":"59d13ac4-528c-4bea-a910-ff3c9a90d656","max_steps":100,"parent_job_name":"purple_picture_m1n9fh45hn","run_manifest_sha256":"0925c720dce1736ce8946a53c41cb34cf782e4c9765376ee444b2434f6b146a0","seed":43,"seed_invariant_training_config_sha256":"1427244f4a3fc937a76b5f60391e078573258effaf591bfc98639843db957dee","source_sha256":"78bb2026f15cdcfe4e78c7ddf5f03198dee22816cfd0914f3106da7927efd553","stage":"minimal_provenance","start_time":"2026-09-01T19:09:54.813560+00:00","status":"completed","steps":100,"training_config_sha256":"634fed77faf6885a783b75ef2a1642c19a4a271bb099a8d37b8a5e6cd20302f8","wall_seconds":7954.348407},{"adapter_artifact_sha256":"04d98bbb552734104c8a4610d0cddff15f500dc96517051e7bcc5d94260a4002","component_name":"grpo_naive","compute":"gpu-t4-dedicated","compute_size":"Standard_NC4as_T4_v3","dataset_manifest_sha256":"8f5d99deb06a31fa0a6203eded8a3591857817c0da510ce93d6750d245934044","end_time":"2026-09-01T20:34:53.162186+00:00","git_commit":"22889199a62835ea2adc5bfee5abf72d628e1002","job_name":"7517534f-64c3-4acf-afd7-6c27e185f4ec","max_steps":100,"parent_job_name":"purple_picture_m1n9fh45hn","run_manifest_sha256":"80b2e2c2f6bd36d55f00b3265a71a4282b75c0b10578ef71cc505cc0adfc7b29","seed":43,"seed_invariant_training_config_sha256":"1427244f4a3fc937a76b5f60391e078573258effaf591bfc98639843db957dee","source_sha256":"78bb2026f15cdcfe4e78c7ddf5f03198dee22816cfd0914f3106da7927efd553","stage":"naive_recall","start_time":"2026-09-01T19:09:54.836621+00:00","status":"completed","steps":100,"training_config_sha256":"634fed77faf6885a783b75ef2a1642c19a4a271bb099a8d37b8a5e6cd20302f8","wall_seconds":5098.325565},{"adapter_artifact_sha256":"6eaa222c041f18622b678567c028373da69074e377b0a701b40b14196e2beed5","component_name":"sft","compute":"gpu-t4-dedicated","compute_size":"Standard_NC4as_T4_v3","dataset_manifest_sha256":"8f5d99deb06a31fa0a6203eded8a3591857817c0da510ce93d6750d245934044","end_time":"2026-09-01T18:55:36.348453+00:00","git_commit":"22889199a62835ea2adc5bfee5abf72d628e1002","job_name":"d507ddc8-d318-4497-a1d6-b4bc37a6e74c","max_steps":100,"parent_job_name":"purple_picture_m1n9fh45hn","run_manifest_sha256":"97d310d24eadf74a805e506ed6230999546e6c892575e158df31d091e4f74e08","seed":43,"seed_invariant_training_config_sha256":"ac0957e7450458f8cd0f0748236876f0df4e8ec3f430b5510d90bb412ed7d1a8","source_sha256":"78bb2026f15cdcfe4e78c7ddf5f03198dee22816cfd0914f3106da7927efd553","stage":"sft","start_time":"2026-09-01T18:37:48.373393+00:00","status":"completed","steps":100,"training_config_sha256":"e4aa133c37b4d88455aad2d5cf9f2fb89dabd98139c0b68251166f2546014e0f","wall_seconds":1067.97506}],"schema_version":"1.0","source_sha256":"78bb2026f15cdcfe4e78c7ddf5f03198dee22816cfd0914f3106da7927efd553"}
